{
  "schemaVersion": 1,
  "options": [
    {
      "id": "Preview",
      "kind": "switch",
      "description": "Show the setup plan without applying its requested changes.",
      "global": true
    },
    {
      "id": "NonInteractive",
      "kind": "switch",
      "description": "Never prompt for input.",
      "global": true
    },
    {
      "id": "Yes",
      "kind": "switch",
      "description": "Grant consent after the setup plan is known.",
      "global": true
    },
    {
      "id": "Json",
      "kind": "switch",
      "description": "Emit the final setup result as JSON.",
      "global": true
    },
    {
      "id": "Quiet",
      "kind": "switch",
      "description": "Reduce normal output while retaining logs and receipt data.",
      "global": true
    },
    {
      "id": "NoColor",
      "kind": "switch",
      "description": "Use plain terminal presentation.",
      "global": true
    },
    {
      "id": "OutputMode",
      "kind": "choice",
      "valueName": "mode",
      "choices": ["Summary", "Stream", "LogOnly"],
      "description": "Select native-process presentation policy.",
      "global": true
    },
    {
      "id": "Verbose",
      "kind": "switch",
      "description": "Use PowerShell's common parameter for detailed progress.",
      "global": true
    },
    {
      "id": "Debug",
      "kind": "switch",
      "description": "Use PowerShell's common parameter for diagnostic debugging.",
      "global": true
    },
    {
      "id": "Branch",
      "kind": "string",
      "valueName": "name",
      "description": "Select the repository branch for repository preparation."
    },
    {
      "id": "SkipDocs",
      "kind": "switch",
      "description": "Skip generated documentation during complete, update, or repair setup."
    }
  ],
  "actionOptions": {
    "full": ["Branch", "SkipDocs"],
    "check": [],
    "repair": ["Branch", "SkipDocs"],
    "update": ["Branch", "SkipDocs"],
    "repo": ["Branch"],
    "tool": [],
    "deps": [],
    "msys2": [],
    "editor": [],
    "doc": [],
    "profiler": [],
    "vs": [],
    "uninstall": [],
    "list": [],
    "help": [],
    "menu": []
  },
  "actions": [
    {
      "id": "full",
      "name": "Complete setup",
      "description": "Install or repair every required component and verify the checkout.",
      "risk": "machine",
      "network": true,
      "mutation": "machine",
      "key": "1"
    },
    {
      "id": "check",
      "name": "Check environment",
      "description": "Verify required tools and project state without changing them.",
      "risk": "read-only",
      "network": false,
      "mutation": "none",
      "key": "2"
    },
    {
      "id": "repair",
      "name": "Repair environment",
      "description": "Reapply required state and exact project pins without ordinary upgrades.",
      "risk": "machine",
      "network": true,
      "mutation": "machine",
      "key": "3"
    },
    {
      "id": "update",
      "name": "Update environment",
      "description": "Update compatible environment software without advancing project pins, update the checkout, then verify.",
      "risk": "machine",
      "network": true,
      "mutation": "machine",
      "key": "4"
    },
    {
      "id": "repo",
      "name": "Prepare repository",
      "description": "Prepare the Git checkout and configure repository-local development state.",
      "risk": "local",
      "network": true,
      "mutation": "local",
      "key": "5"
    },
    {
      "id": "tool",
      "name": "Install project tools",
      "description": "Install or repair declared exact/compatible project tools without advancing pins.",
      "risk": "machine",
      "network": true,
      "mutation": "machine",
      "key": "6"
    },
    {
      "id": "deps",
      "name": "Prepare dependency cache",
      "description": "Fetch or reuse the exact dependency sources required by the checkout.",
      "risk": "local",
      "network": true,
      "mutation": "local",
      "key": "7"
    },
    {
      "id": "msys2",
      "name": "Configure MSYS2",
      "description": "Install or repair declared UCRT64 and CLANG64 packages.",
      "risk": "machine",
      "network": true,
      "mutation": "machine",
      "key": "8"
    },
    {
      "id": "editor",
      "name": "Configure editors/IDEs",
      "description": "Choose editors and install their GameWIP integrations.",
      "risk": "machine",
      "network": true,
      "mutation": "machine",
      "key": "9"
    },
    {
      "id": "doc",
      "name": "Build documentation",
      "description": "Build and verify the generated manual.",
      "risk": "local",
      "network": false,
      "mutation": "local",
      "key": "0"
    },
    {
      "id": "profiler",
      "name": "Install matching Tracy profiler tools",
      "description": "Prepare or reuse the locked Tracy source, then build and install matching profiler tools.",
      "risk": "machine",
      "network": true,
      "mutation": "machine",
      "key": "P"
    },
    {
      "id": "vs",
      "name": "Install/repair Visual Studio",
      "description": "Apply the repository Visual Studio configuration.",
      "risk": "machine",
      "network": true,
      "mutation": "machine",
      "key": "V"
    },
    {
      "id": "uninstall",
      "name": "Uninstall GameWIP-owned resources",
      "description": "Inventory and remove only resources with sufficient GameWIP ownership evidence.",
      "risk": "destructive",
      "network": true,
      "mutation": "destructive",
      "key": "U"
    },
    {
      "id": "list",
      "name": "List setup actions",
      "description": "List supported setup actions and their behavior.",
      "risk": "read-only",
      "network": false,
      "mutation": "none"
    },
    {
      "id": "help",
      "name": "Show setup help",
      "description": "Print command-line usage and common options.",
      "risk": "read-only",
      "network": false,
      "mutation": "none"
    },
    {
      "id": "menu",
      "name": "Open the interactive setup menu",
      "description": "Open the persistent setup menu.",
      "risk": "read-only",
      "network": false,
      "mutation": "none"
    }
  ],
  "bootstrapToolIds": ["msys2"]
}
